{
  "$schema": "https://json-schema.org/draft/2020-12/schema",
  "$id": "space.ag2/typed-room-behavior-manifest/v1",
  "title": "Typed-room behavior manifest (per-type agent-behavior declaration)",
  "description": "The per-type declaration the behavior loop executes. Track 13 operating contract: an agent resolves this manifest from the TRUSTED PLATFORM REGISTRY by room type — never fetched-and-obeyed from room-supplied content (injection-safe). The manifest declares what the loop may auto-do (safe tier), what it may only propose (advance tier, expressed in the room's own verb grammar so the owner approves by replying with the verb), and how the type's data object is loaded and analyzed. A new room type = a new manifest, not new code paths.",
  "type": "object",
  "required": ["type", "version", "entity", "state_model", "data_object", "analyze", "tiers"],
  "properties": {
    "type": {
      "type": "string",
      "description": "Room type id, matching space.ag2.roomtype {type} (e.g. 'piperoom', 'inboxroom')."
    },
    "version": { "type": "integer", "minimum": 1 },
    "entity": {
      "type": "string",
      "description": "The primary entity the room manages (e.g. 'PipelineEntry', 'InboxItem')."
    },
    "state_model": {
      "type": "string",
      "enum": ["linear-stages", "drain-queue", "dag", "open-set", "calendar", "decision", "registry", "automation"],
      "description": "The state-model shape — the framework's type discriminator."
    },
    "data_object": {
      "type": "object",
      "required": ["folder", "filename"],
      "properties": {
        "folder": { "type": "string" },
        "filename": { "type": "string" }
      },
      "description": "Where the room's data object lives in its vault (prep_get/prep_put)."
    },
    "analyze": {
      "type": "object",
      "required": ["module", "function"],
      "properties": {
        "module": { "type": "string", "description": "Repo-relative path of the skill module holding the attention primitive." },
        "function": { "type": "string", "description": "Function(data) -> attention items [{id,name/title,reasons[],...}]." }
      },
      "description": "The type's analysis primitive (the detect half of the behavior loop)."
    },
    "autonomy_default": {
      "type": "string",
      "enum": ["propose", "safe"],
      "default": "safe",
      "description": "Default autonomy when the room's data object doesn't set one. 'full' is deliberately NOT a valid manifest value — advance-tier actions never auto-fire from a manifest."
    },
    "cooldown_s": {
      "type": "integer",
      "minimum": 300,
      "default": 10800,
      "description": "Minimum seconds between behavior posts to the same room."
    },
    "tiers": {
      "type": "object",
      "required": ["safe", "advance"],
      "properties": {
        "safe": {
          "type": "object",
          "required": ["reasons", "actions"],
          "properties": {
            "reasons": {
              "type": "array",
              "items": { "type": "string" },
              "description": "Attention reasons that classify an item as safe-tier. An item auto-executes ONLY if ALL its reasons are in this set."
            },
            "actions": {
              "type": "array",
              "items": {
                "type": "object",
                "required": ["name", "effect"],
                "properties": {
                  "name": { "type": "string" },
                  "effect": {
                    "type": "string",
                    "enum": ["additive"],
                    "description": "Safe-tier actions are ADDITIVE by contract (append/fill, never move/close/delete)."
                  },
                  "tool": {
                    "type": "object",
                    "properties": {
                      "hub_slug": { "type": "string", "description": "Neon skill-catalog slug of the cloud tool." },
                      "tool": { "type": "string", "description": "MCP tool name." }
                    },
                    "description": "Optional Hub cloud-tool binding used to perform the action."
                  },
                  "requires": { "type": "string", "description": "Precondition tag the executor checks (e.g. 'linkedin_url_in_notes')." },
                  "max_per_pass": { "type": "integer", "minimum": 1, "default": 3 }
                }
              }
            }
          }
        },
        "advance": {
          "type": "object",
          "required": ["verbs"],
          "properties": {
            "reasons": { "type": "array", "items": { "type": "string" } },
            "reason_prefixes": { "type": "array", "items": { "type": "string" } },
            "verbs": {
              "type": "object",
              "additionalProperties": { "type": "string" },
              "description": "reason (or 'prefix*' or 'default') -> proposal template in the room's OWN verb grammar, '{name}' interpolated. The owner approves by replying with the verb; the type's existing command handler applies it — no bespoke approval machinery."
            }
          }
        }
      }
    }
  }
}
